{"channel":"ios","counts":{"builtin":0,"deepAdaptation":9,"offerQualified":39,"optional":39,"packaged":39,"qualified":39,"reviewed":39,"total":39},"entries":[{"category":"writing-communication","deepAdaptation":false,"description":{"en":"Shape an outline, draft sections and revise a document together.","zh-Hans":"共同梳理提纲、撰写章节和修改文稿，逐步完成一份文档。"},"firstParty":null,"id":"doc-coauthoring","installOffer":"qualified","kind":"optional","minimumAppVersion":"1.7.59","name":{"en":"Doc Co-authoring","zh-Hans":"文档协作"},"notes":{"en":"Floe original guide. Replaces the original candidate with independently authored content; upstream text is not distributed. Candidate identity and provenance remain in the package.","zh-Hans":"Floe 原创指南，以独立编写的内容替代原候选，不分发其上游文本。包内保留候选来源与处理记录。"},"package":{"containsScripts":false,"contentDigest":"c178ab41650ac4c9b94020f1c6738ec39c66c78e75d9388798c2bcaccc21b24f","path":"packages/doc-coauthoring/1.0.0/doc-coauthoring.zip","sha256":"c90171f6830b79d99bb0126dfe0f6790f7e8d76392644584a256d266599995ae","size":26425},"planNumber":5,"review":{"keyID":"official-2026-09","path":"reviews/doc-coauthoring/1.0.0.review.json","sha256":"9b3e498885d08f62aaabc63d309f74017f4c6d1b824448c9f14df64eda437b2a"},"runtime":{"capabilities":["workspace.read","workspace.write"],"execution":{"arch":"n/a","evidence":"unproven","os":null},"installPlatforms":["ios"],"pythonPackagesPlan":[],"scriptRuntime":"none","tools":[]},"source":"F","status":{"adaptation":"frozen","executionVerified":false,"licenseChecked":true,"packaged":true,"published":true,"qualified":true,"reviewed":true,"sourcePinned":true},"tags":["writing","collaboration","documents"],"upstream":null,"version":"1.0.0"},{"category":"writing-communication","deepAdaptation":false,"description":{"en":"Write internal announcements, progress updates and retrospectives for the right audience.","zh-Hans":"撰写内部通知、进度更新和复盘，让信息适合受众与场合。"},"firstParty":null,"id":"internal-comms","installOffer":"qualified","kind":"optional","minimumAppVersion":"1.7.59","name":{"en":"Internal Comms","zh-Hans":"内部沟通"},"notes":{"en":"","zh-Hans":""},"package":{"containsScripts":false,"contentDigest":"697e3e2ef4edcfcae0970f6f985658fe5e1c0d6754f1b6d92795ec6b83302a78","path":"packages/internal-comms/1.0.0/internal-comms.zip","sha256":"9653cf16a282776e61af910272d947d29fe23fd01fa0615c06423ce12394d3e2","size":25965},"planNumber":6,"review":{"keyID":"official-2026-09","path":"reviews/internal-comms/1.0.0.review.json","sha256":"f2aa0c7181baa7b0ffb2237f7267cfe84525d6f17af4ce217a157c9276b80a5d"},"runtime":{"capabilities":["workspace.read","workspace.write"],"execution":{"arch":"n/a","evidence":"unproven","os":null},"installPlatforms":["ios"],"pythonPackagesPlan":[],"scriptRuntime":"none","tools":[]},"source":"A","status":{"adaptation":"frozen","executionVerified":false,"licenseChecked":true,"packaged":true,"published":true,"qualified":true,"reviewed":true,"sourcePinned":true},"tags":["writing","comms","templates","workplace"],"upstream":{"commit":"dbd4588f9e1033efb41dad4bef2f7947c8993d44","licenseEvidencePath":"skills/internal-comms/LICENSE.txt","licenseNote":{"en":"The pinned skill subtree and shipped references were audited; full applicable license and per-file adaptation/asset notes are preserved under references/licenses/ and references/PROVENANCE.md.","zh-Hans":"已核验固定技能子树与所附参考资料，完整适用许可及逐文件适配、素材记录保存在 references/licenses/ 与 references/PROVENANCE.md。"},"licenseStatus":"verified","path":"skills/internal-comms","repository":"https://github.com/anthropics/skills","repositoryLicense":"Apache-2.0 (per-skill LICENSE.txt)","retrievedAt":"2026-10-26","skillManifestPath":"skills/internal-comms/SKILL.md"},"version":"1.0.0"},{"category":"writing-communication","deepAdaptation":false,"description":{"en":"Review wording, formatting and consistency to make technical writing clearer.","zh-Hans":"检查措辞、格式与表达一致性，让技术写作更清楚。"},"firstParty":null,"id":"writing-guidelines","installOffer":"qualified","kind":"optional","minimumAppVersion":"1.7.59","name":{"en":"Writing Guidelines","zh-Hans":"技术写作检查"},"notes":{"en":"Floe original guide. Replaces the original candidate with independently authored content; upstream text is not distributed. Candidate identity and provenance remain in the package.","zh-Hans":"Floe 原创指南，以独立编写的内容替代原候选，不分发其上游文本。包内保留候选来源与处理记录。"},"package":{"containsScripts":false,"contentDigest":"1ce612756ea9d2e88525950f930a8927675d0ea7e1db413ec6134aff8777c20d","path":"packages/writing-guidelines/1.0.0/writing-guidelines.zip","sha256":"2a4a27918cc640302c8e6c6aef80047208d8e166d1ef7249b5e7d6f76e4b8e5c","size":26656},"planNumber":7,"review":{"keyID":"official-2026-09","path":"reviews/writing-guidelines/1.0.0.review.json","sha256":"32690487b7afe1a96db86f9ecf7d75b0a6bfd0e1711f71d63dd83caa9494263d"},"runtime":{"capabilities":["workspace.read"],"execution":{"arch":"n/a","evidence":"unproven","os":null},"installPlatforms":["ios"],"pythonPackagesPlan":[],"scriptRuntime":"none","tools":[]},"source":"F","status":{"adaptation":"frozen","executionVerified":false,"licenseChecked":true,"packaged":true,"published":true,"qualified":true,"reviewed":true,"sourcePinned":true},"tags":["writing","style","guidelines","review"],"upstream":null,"version":"1.0.0"},{"category":"writing-communication","deepAdaptation":false,"description":{"en":"Write clear, persuasive copy for product pages, landing pages and campaigns.","zh-Hans":"为产品页、落地页和推广内容撰写清楚、有说服力的文案。"},"firstParty":null,"id":"copywriting","installOffer":"qualified","kind":"optional","minimumAppVersion":"1.7.59","name":{"en":"Copywriting","zh-Hans":"网站文案"},"notes":{"en":"","zh-Hans":""},"package":{"containsScripts":false,"contentDigest":"e8f7834cc3c4639bf26c69b1ceed73b428531d0f68e5703428090064e800c825","path":"packages/copywriting/1.0.0/copywriting.zip","sha256":"49fdb6b98706c37c7bd1c7205e0f67d2f7473c6a3b77ffa05e966cf2e94461c1","size":28296},"planNumber":8,"review":{"keyID":"official-2026-09","path":"reviews/copywriting/1.0.0.review.json","sha256":"681a2e4ff116fe4ab6f03cc5728318d75f85090af44f652abc9884bd2cd87742"},"runtime":{"capabilities":["workspace.read","workspace.write"],"execution":{"arch":"n/a","evidence":"unproven","os":null},"installPlatforms":["ios"],"pythonPackagesPlan":[],"scriptRuntime":"none","tools":[]},"source":"R","status":{"adaptation":"frozen","executionVerified":false,"licenseChecked":true,"packaged":true,"published":true,"qualified":true,"reviewed":true,"sourcePinned":true},"tags":["copywriting","marketing","website","tone"],"upstream":{"commit":"6d2f02ea077eead1bee5411a31bcc6db5a11a70c","licenseEvidencePath":"LICENSE","licenseNote":{"en":"The pinned skill subtree and shipped references were audited; full applicable license and per-file adaptation/asset notes are preserved under references/licenses/ and references/PROVENANCE.md.","zh-Hans":"已核验固定技能子树与所附参考资料，完整适用许可及逐文件适配、素材记录保存在 references/licenses/ 与 references/PROVENANCE.md。"},"licenseStatus":"verified","path":"marketing-skill/skills/copywriting","repository":"https://github.com/alirezarezvani/claude-skills","repositoryLicense":"MIT (root LICENSE)","retrievedAt":"2026-10-26","skillManifestPath":"marketing-skill/skills/copywriting/SKILL.md"},"version":"1.0.0"},{"category":"writing-communication","deepAdaptation":false,"description":{"en":"Refine structure, wording and tone so existing copy is easier to understand.","zh-Hans":"修订已有文案的结构、措辞与语气，让重点更容易读懂。"},"firstParty":null,"id":"copy-editing","installOffer":"qualified","kind":"optional","minimumAppVersion":"1.7.59","name":{"en":"Copy Editing","zh-Hans":"文案校订"},"notes":{"en":"","zh-Hans":""},"package":{"containsScripts":false,"contentDigest":"6511986d6a1b9ccd0b69e244d2cf68cd293d874df8204544f931422efe7fa6d8","path":"packages/copy-editing/1.0.0/copy-editing.zip","sha256":"400ba11b7a2e7d84f74ae054dd3d0ceb6e468c8b4e821969959cc9db4695a17b","size":34604},"planNumber":9,"review":{"keyID":"official-2026-09","path":"reviews/copy-editing/1.0.0.review.json","sha256":"a4496dbd28da6fee30a57abe1aa0169d7b1f47fb7c679835bb378bdb711cad68"},"runtime":{"capabilities":["workspace.read","workspace.write"],"execution":{"arch":"n/a","evidence":"unproven","os":null},"installPlatforms":["ios"],"pythonPackagesPlan":[],"scriptRuntime":"none","tools":[]},"source":"R","status":{"adaptation":"frozen","executionVerified":false,"licenseChecked":true,"packaged":true,"published":true,"qualified":true,"reviewed":true,"sourcePinned":true},"tags":["editing","copy","review","consistency"],"upstream":{"commit":"6d2f02ea077eead1bee5411a31bcc6db5a11a70c","licenseEvidencePath":"LICENSE","licenseNote":{"en":"The pinned skill subtree and shipped references were audited; full applicable license and per-file adaptation/asset notes are preserved under references/licenses/ and references/PROVENANCE.md.","zh-Hans":"已核验固定技能子树与所附参考资料，完整适用许可及逐文件适配、素材记录保存在 references/licenses/ 与 references/PROVENANCE.md。"},"licenseStatus":"verified","path":"marketing-skill/skills/copy-editing","repository":"https://github.com/alirezarezvani/claude-skills","repositoryLicense":"MIT (root LICENSE)","retrievedAt":"2026-10-26","skillManifestPath":"marketing-skill/skills/copy-editing/SKILL.md"},"version":"1.0.0"},{"category":"writing-communication","deepAdaptation":false,"description":{"en":"Plan topics and outlines, organize long-form content and develop a draft.","zh-Hans":"从选题与提纲开始，组织长文内容并逐步完成初稿。"},"firstParty":null,"id":"content-production","installOffer":"qualified","kind":"optional","minimumAppVersion":"1.7.59","name":{"en":"Content Production","zh-Hans":"长文创作"},"notes":{"en":"","zh-Hans":""},"package":{"containsScripts":false,"contentDigest":"61f086384948a8950a79569e7da39be166c02043e88467a7c9279e49d4069f90","path":"packages/content-production/1.0.0/content-production.zip","sha256":"224c1cac3b15b20a252b4fc03b53f79862ede451786d3b41604830876c38ffb5","size":39190},"planNumber":10,"review":{"keyID":"official-2026-09","path":"reviews/content-production/1.0.0.review.json","sha256":"361f6ba835438573d3f794442ddb8280114bc3da3735502cae97875992b50617"},"runtime":{"